{"schema":"gate-verdict/v2","verdict":"FAIL","tasks":[{"task":"T1","verdict":"FAIL","findings":[{"summary":"s","kind":"wrong-reason"},{"summary":"s","kind":"not-contract"},{"summary":"s","kind":"task-reach"},{"summary":"s","kind":"unpassable"},{"summary":"s","kind":"pins-unnamed"},{"summary":"s","kind":"uncovered"},{"summary":"s","kind":"check-gap"}]},{"task":"T2","verdict":"PASS","findings":[]}],"notes":"none"}
